{"contract":{"name":"qa-run/execution-result","version":"1.0.0"},"skill":{"name":"qa-run","version":"0.2.0"},"generatedAt":"2026-07-18T11:05:03Z","summary":"Smoke run executed: 1 passed, 1 failed.","classification":"failed","evidence":[{"type":"report","description":"reporter","source":"results.json"}],"execution":{"strategy":"smoke","command":"pnpm exec playwright test","exitCode":1},"framework":{"name":"playwright"},"tests":{"total":2,"passed":1,"failed":1,"skipped":0},"environment":{"location":"local","headless":true},"artifacts":[]}
